id,id2,city_county_state,latitude,longitude,elevation,month,day,year
fredericksburg,fredericksburg3," Fredericksburg, Caroline County, Virginia",38.171797,-77.191088,506,April,30,1978
richmond,richmond1," Richmond, New Kent County, Virginia",37.54129,-77.434769,50.7,May,9,1970
winchester,winchester1," Winchester, Loudon County, Virginia",39.111217,-77.833884,301,May,30,1904
accomac,accomac,"Accomac, Accomack County, Virginia",37.807972,-75.594222,301,April,3,2011
alexandriacity,alexandriacity,"Alexandria City, N/A, Virginia",38.82045,-77.050552,85,April,6,1972
alexandria,alexandria1,"Alexandria, Arlington County, Virginia",38.82045,-77.050552,54,April,24,1939
charoltesville,charoltesville1,"Charlotesville, Goochland County, Virginia",38.033554,-78.50798,149,April,29,1971
charoltesville,charoltesville2,"Charlottesville, Madison County, Virginia",38.280965,-78.140835,301,May,3,1978
charoltesville,charoltesville3,"Charlottesville, Orange County, Virginia",38.033554,-78.50798,149,May,1,1971
emporia,emporia,"Emporia, Southampton County, Virginia",36.583207,-77.199968,1705,March,31,1979
exmore,exmore,"Exmore, Northamptom County, Virginia",37.352637,-75.945765,986,October,11,1935
franlkin,franlkin,"Franklin, Southampton County, Virginia",36.716261,-77.06802,2069,April,6,1939
fredericksburg,fredericksburg1,"Fredericksburg, Norfolk County, Virginia",38.309875,-77.466316,41,April,9,1969
fredericksburg,fredericksburg2,"Fredericksburg, Westmoreland County, Virginia",38.309875,-77.466316,77,May,11,1999
hampton,hampton,"Hampton , N/A, Virginia",37.005608,-76.304864,301,April,7,1887
harrisonburg,harrisonburg1,"Harrisonburg, Page County, Virginia",38.449569,-78.868916,404,April,12,2002
harrisonburg,harrisonburg2,"Harrisonburg, Rockham County, Virginia",38.449569,-78.868916,404,April,2,1962
harrisonburg,harrisonburg2,"Harrisonburg, Rockingham County, Virginia",38.4333,-78.8667,301,March,22,1983
harrisonburg,harrisonburg3,"Harrisonburg, Rockingham County, Virginia",38.378572,-78.969529,2380,May,2,1984
harrisonburg,harrisonburg4,"Harrisonburg, Rockingham County, Virginia",38.4333,-78.8667,301,April,23,1980
harrisonburg,harrisonburg5,"Harrisonburg, Rockingham County, Virginia",38.486234,-78.959752,301,April,22,1984
harrisonburg,harrisonburg6,"Harrisonburg, Rockingham County, Virginia",38.4333,-78.8667,301,April,20,1976
harrisonburg,harrisonburg7,"Harrisonburg, Rockingham County, Virginia",38.4333,-78.8667,301,April,13,2002
harrisonburg,harrisonburg8,"Harrisonburg, Rockingham County, Virginia",38.403968,-78.856954,301,April,25,1984
harrisonburg,harrisonburg9,"Harrisonburg, Rockingham County, Virginia",38.4333,-78.8667,301,April,7,1976
richmond,richmond15,harrisonburg4,37.958745,-76.758014,301,May,4,1979
hopewell,hopewell1,"Hopewell, Charles City County, Virginia",37.304315,-77.2872,15,April,17,1978
hopewell,hopewell2,"Hopewell, Fanquier County, Virginia",37.304315,-77.2872,15,May,9,1930
leesburg,leesburg,"Leesburg, Loudoun County, Virginia",39.1055,-77.5547,104,April,24,1969
lynchburg,lynchburg4,"Lynchburg, Accomack County, Virginia",37.9436527,-75.540227,301,April,3,2011
lynchburg,lynchburg1,"Lynchburg, Campbell County, Virginia",37.233756,-79.289469,301,April,10,1984
lynchburg,lynchburg3,"Lynchburg, Campbell County, Virginia",37.233756,-79.289469,301,April,10,1984
lynchburg,lynchburg2,"Lynchburg, Charlotte County, Virginia",37.040429,-78.483328,1574,April,21,1979
middlesexcounty,middlesexcounty,"N/A. Middlesex County, Virginia",37.6334553,-76.55146282,9,April,29,1932
newportnews,newportnews,"Newport News, Isle of Wight County, Virginia",37.057137,-76.674647,7416,April,8,1979
norfolk,norfolk1,"Norfolk City, N/A, Virginia",36.891413,-76.300174,301,March,31,1975
norfolk,norfolk2,"Norfolk City, N/A, Virginia",36.891413,-76.300174,301,March,31,1975
norfolk,norfolk4,"Norfolk City, N/A, Virginia",36.934563,-76.236818,301,April,4,1970
norfolk,norfolk5,"Norfolk City, N/A, Virginia",36.934563,-76.236818,301,April,4,1970
norfolk,norfolk6,"Norfolk City, N/A, Virginia",36.880981,-76.307719,301,March,31,1978
norfolk,norfolk7,"Norfolk City, N/A, Virginia",36.883707,-76.306397,301,March,25,2004
norfolk,norfolk3,"Norfolk City, Norfolk County, Virginia",36.887689,-76.305101,301,March,9,1969
norfolk,norfolk1,"Norfolk, N/A., Virginia",36.850769,-76.285873,2.134,March,31,1975
norfolk,norfolk8,"Norfolk, Norfolk County, Virginia",36.891447,-76.315355,301,April,1,1966
pocomokecity,pocomokecity,"Pocomoke City, Accomac County, Virginia",38.068904,-75.561718,2,May,22,1938
radford,radford3,"Radford, Floyd County, Virginia",37.131792,-80.576448,641,May ,5,1976
radford,radford1,"Radford, Montgomery County, Virginia",37.131792,-80.576448,641,March,27,1981
radford,radford2,"Radford, Montgomery County, Virginia",37.131792,-80.576448,641,May,17,1978
reston,reston,"Reston, Fairfax County, Virginia",38.968721,-77.341096,6343,April,13,1971
richmond,richmond7.5,"Richmond City, N/A, Virginia",37.54129,-77.434769,50.7,April,1,1932
richmond,richmond8,"Richmond City, N/A, Virginia",37.54129,-77.434769,50.7,May,20,1931
richmond,richmond9,"Richmond City, N/A, Virginia",37.54129,-77.434769,50.7,April ,4,1931
richmond,richmond10,"Richmond City, N/A, Virginia",37.54129,-77.434769,50.7,April ,27,1931
richmond,richmond12,"Richmond City, N/A, Virginia",37.54129,-77.434769,50.7,April,13,1973
richmond,richmond13,"Richmond City, N/A, Virginia",37.54129,-77.434769,50.7,April,29,1971
richmond,richmond4,"Richmond, Hanover County, Virginia",37.54129,-77.434769,50.7,April,2,1978
richmond,richmond11,"Richmond, Hanover County, Virginia",37.54129,-77.434769,50.7,April,16,1978
richmond,richmond5,"Richmond, Henrico County, Virginia",37.54129,-77.434769,50.7,April,25,1932
richmond,richmond6,"Richmond, Henrico County, Virginia",37.54129,-77.434769,50.7,March,29,1935
richmond,richmond7,"Richmond, Henrico County, Virginia",37.54129,-77.434769,50.7,April,23,1931
richmond,richmond14,"Richmond, New Kent County, Virginia",37.54129,-77.434769,50.7,May,9,1970
richmond,richmond3,"RIchmond, Nottoway County, Virginia",37.54129,-77.434769,50.7,May,3,1942
richmond,richmond2,"Richmond, Powhatan County, Virginia",37.54129,-77.434769,50.7,March,8,1976
roanokecounty,roanokecounty,"Roanoke County, Virginia",37.270969,-79.941429,530,June,12,1979
staunton,staunton,"Staunton, Highland County, Virginia",38.412343,-79.580604,776,August,10,1978
suffolkcity,suffolkcity2,"Suffolk City, N/A, Virginia",36.73283,-76.579002,31,March,9,2009
suffolkcity,suffolkcity1,"Suffolk City, Virginia",36.73283,-76.579002,31,April,1,1979
virginiabeach,virginiabeach1,"Virginia Beach, N/A, Virginia",36.852926,-75.977985,301,March,22,1978
virginiabeach,virginiabeach2,"Virginia Beach, Princess Anne, Virginia",36.765371,-76.156214,301,April,23,1966
williamsburg,williamsburg,"Williamsburg City, N/A, Virginia",37.271133,-76.716614,26,November,18,1999
williamsburg,williamsburg2,"Williamsburg City, N/A, Virginia",37.271133,-76.716614,26,April,13,1967
williamsburg,williamsburg4,"Williamsburg, James City County, Virginia",37.270702,-76.707457,301,February,20,1939
williamsburg,williamsburg3,"Williamsburg, York Country, Virginia",37.2707,-76.7075,85,May,26,1975
winchester,winchester3,"Winchester, Frederick County, Virginia",39.071834,-78.323513,301,May,8,1971
winchester,winchester4,"Winchester, Shenandoah County, Virginia",38.8719,-78.5769,301,May,5,2011
winchester,winchester2,"Winchester, Warren County, Virginia",39,-78.15,301,August,17,1980